Username,Title,Content,Rating,Date
Simon Cooper,Let down by Tesla assistance,Had a puncture and logged for assistance at around midnight and managed to get child home thanks to a lift from friends Arranged for Tesla to recover vehicle at 8am this morning which was agreed Couldn t get responses from Tesla to make sure all on track and nobody picked up on the recovery vehicle number they provided Returned to vehicle at 4am just in case Managed finally to get through to Tesla at 8am and it was clear they had not put the recovery request through Now stranded miles from home waiting wi,1,2023-10-07
RONNIE STANLEY,I have a 2020 tesla 3 standard range,I have a 2020 tesla 3 standard range model with 35000 miles I have complained for years that the battery range has been degrading and at the present time it will only charge to 211 miles which is a big difference from the 250 that it was suppose to get I have complained to tesla to remedy the problem or replace the battery I have gotten all kind of explanations which most do not make any logical sense I have an engineer and have requested to speak with one but that has not happen They are not standing by ,1,2023-10-05
Bryan DD,If you have any problems you re on your own,Where to start with Tesla Picked up the car from Manchester airport filthy Within 2 days complained that the rear bumper was off white cream compared to the rest of the car told this is normal and no corrective action would be taken Problem with the driver s seat moving apparently a feature within tolerance limits which may leave the customer very annoyed but which Tesla refused to do anything about after numerous requests Sold the car and took a big hit due to the mis coloured bumper has the car been in ,1,2023-10-04
Darren Conway,Very expensive to run,Overpriced terrible service breakdown loads and wait to see service and repair bills Don't expect to speak to anyone in a tesla garage it's all messages and they never answer,1,2023-10-04
Zachary Lucas,Tesla Overpriced Garbage,Seemingly Nothing about Tesla is as appears online or sales from Ridiculous Insurance ratings pricing to the degradation of the Battery over a few years daily battery mileage ITs all BS The time waiting for hours and hours on phone for anyone to assist 12V battery issues Paint issues that clearly are issues for this brand Overall Tesla is over priced and spend much time needed repairs in a system who can't keep up with the number of problems with the cars,1,2023-10-03
ole frandsen,Do not buy anything from Tesla,Do not buy anything from Tesla Elon Musk supports Russia's war against Ukraine Shame on You,1,2023-10-03
John Doe,Tesla tried to rob me for 15 thousand for a minor maintanence issue,Do not trust Tesla customer service for any mechanical errors After my car wouldn't charge I contacted Tesla they kept insisting I needed to replace the primary car battery on my Model S with only 67k miles This replacement would've costed 15k I took it to a 3rd party mechanic they informed me nothing was wrong with my primary battery it was my secondary battery that actually needed to be replaced The secondary battery only costed 389 So they tried to rob me of 15 thousand dollars along with my battery be,1,2023-10-03
Power House,Overrated garbage cars,Horrible customer service and poorly quality made cars Social media Elon Musk power over convincing people to buy trash is amazing,1,2023-09-30
Sam Sutton,Constant problems with battery,Constant problems with battery absolute nightmare to deal with Better off with established trustworthy company,1,2023-09-28
UDAYA YARI,this is a eco frindy so that i like,,5,2023-09-28
Mark Stevens,I like my car BUT,I like my car S plaid and only had it six months but has been the biggest loss of hard earned money I have ever experienced The week before I got my car they got my money on there plaid program then price dropped 5k but I got this back now the price dropped another 10k and this is a total loss to me this car is 15 000 less than I paid new today Great investment thanks Elon Don t have customer support so think before you buy a Tesla,3,2023-09-26
Sav Ma,The customer service representative,The customer service representative hung on me when I informed him that I need sometime to think about taking the Tesla platinum coverage looks like take it now or I am not talking anymore,1,2023-09-25
Daniel Wall,Bad car,Bad car 3 major repairs with in 20k miles Terrible and horrible Never buy A Tesla again,1,2023-09-25
Consumer,Best car I ve ever rode,Best car I ve ever had I got a model three and a model Y went to service twice in 2 1 2 years It s been perfect every time,5,2023-09-24
VE,Tesla has the absolute worst customer,Tesla has the absolute worst customer service You can never reach anyone I just had a traumatic accident and because their agent didn't know their job protocol my car wasn't towed until 730 a m from 1 a m and they refused to give me a loaner car so I couldn't get home A loaner car is standard practice I had a Lexus before this car and they treated the consumer with care I was stranded in Newberg New York begging lift and Uber drivers to please don't cancel my ride to Manhattan where I live Finally at 830 ,1,2023-09-23
Chloe Sproson,AVOID AT ALL COSTS,The rudest staff ever Worst customer service known to man Jo Brooke s at Sheffield branch is a stuck up ignorant rude lady who lies and shouldn t be in a job Poor quality cars that fall apart 4 months oldOur car and nothing but problems which Tesla refuse to solve,1,2023-09-23
Amy Morris,Shocking customer service,Shocking customer service zero handover having spent 47k on a brand new car Changed the reg without notifying me Zero help from staff and made to feel so worthless I m disgusted,1,2023-09-22
Virender Singh,Tesla dealerships,I bought A Tesla model Y today I have been buying cars for 50 years This was my worst experience They did not provide any paperwork She spent 5 minutes with us to sign the forms and collect check from us There was no guidance to help understand controls or App,1,2023-09-22
William,Great car great charging great service,I love the car and the charging experience and the service has been great I have a 2022 Model Y which from my perspective drives like a sports car It isn't a cushy ride so it's not for everyone The performance however is great This is my third electric car and by far the best as the first two were what I would call first generation vehicles with around 100 miles of range good for regional use only This one is fantastic for road trips I went from scrambling to find CHAdeMO chargers that were not broken and,5,2023-09-21
Salam Saber,I hope that nobody is going to busy a,I hope that nobody is going to busy a tesla Car I recently bought a brand new Car and i used it only for 3 weeks and the power steering did not work while i was in the road This is really dangerous especially of you are on the highway Ik hoop dat niemand een Tesla auto gaat bezetten Ik heb onlangs een gloednieuwe auto gekocht en ik heb hem slechts 3 weken gebruikt en de stuurbekrachtiging werkte niet terwijl ik onderweg was Dit is echt gevaarlijk vooral als je op de snelweg bent,1,2023-09-20
Mark,Tesla power steering and customer care failure,Had a Model Y for less than 2 months and the power steering has failed while I was driving Technician has attended to say it should not be driven and arranged for it to be towed to Manchester Service Centre Not been able to drive the car for a week already and have no idea how long it will be until my car is returned Tesla say that they don't have any loan cars available and will let me know when they get one I need this car to do my job All comms via the stupid App Really poor customer service Had I know,1,2023-09-20
Tabassum Yousuf Dyer,Good luck,I have been trying g to add a vehicle on the tesla app Uploaded all documents it s stated 3 5 days 2 weeks later re uploaded documents again but still no vehicle or access on the tesla app Very poor customer service no communication or updates No one really knows what s happening Extremely disappointing Good Luck,1,2023-09-19
customer,No support at all,Bought a used M3 Trying to add it to my account for a week now No support at all Try to find an email to contact incredible How can one buy a new car after such experience,1,2023-09-19
Howard Robins,Do business with people Don t do business with a computer,I just returned a Tesla model S long range off a three year lease I can put aside that you never can speak to anyone when you have a problem with the car They always give you a month before they will fix it and after about 2 3 weeks fix it through the internet Seems like they should have done it immediately Had a flat tire They texted me that I had to agree to three things 1 They needed to tow it to a repair shop 2 To fix it 121 00 plus tax 3 If unfixable 320 to replace it I had to agree to all three I sa,1,2023-09-19
George Stamatakos,Not Your Typical New Car Purchase,Update There has been some progress it's not the usual in person new car purchase process that I am used to but Tesla staff eventually did address my concerns My experience with Tesla's customer service has been extremely frustrating I've tried to contact them multiple times for help with my purchase but each time I was hung up on within a minute This lack of support during the purchase process makes me concerned about the quality of the service I'll receive after the sale,3,2023-10-02
Michael Shriqui,Tesla horrible customer service,Tesla Keri s disappointing Not only are their products sub par but their customer service is the absolute pits I ve owned testa cars for over 6 years and I m quite disappointed in how they age badly Now I can see that the Wall Connector Home charging station is also the pits I purchased my first one when I bought my Tesla model Y Three months after the 4 year warranty expired the charger stopped working When I contacted Tesla about servicing it I was told they do not service it and that I would need to bu,1,2023-09-16
yuval,VERY Poor Tesla Solar customer service,VERY Poor Tesla Solar customer service we have solar in two houses and it stopped generating electricity Called Tesla 12 times finally they admitted they pushed new software version that generated an error in our system No remote fix Yes appointment in two weeks Such a bad experience I will never do Tesla in ANY of my homes and good they are dropping solar,1,2023-09-15
SC,Buying from Tesla has been the worst,Buying from Tesla has been the worst experience I have ever had and I am in the automotive industry I was forced to pay fees before I could get the final numbers I struggled to get documents needed for my credit union Then when it came to pick up they needed a few days with my new car but then I only had three days to pick up or loose my money and I only had certain hours and no morning hours for pick up Worst experience ever,1,2023-09-15
Ray,Left with non functioning home charger,I reported a fault on my home charger which is still in warranty on 21st August After spending a couple of hours exchanging emails and testing various suggestions made by the support team I was eventually asked for my shipping address It was not made clear what was being shipped but I presumed it was a replacement charger In the 3 weeks since then nothing has arrived and my requests for a tracking number has been ignored I love my Tesla Model X but am coming to dislike the company due to its poor customer,1,2023-09-15
Hue Higgins,I ve left one star as you can t leave,I ve left one star as you can t leave zero Tesla Glasgow service centre is an absolute disgrace of a place the worst workmanship I ve ever seen Replaced faulty parts with damaged parts and not fitted correctly also Damaged bodywork and interior trims and try to deny it And repeatedly having to go back for the same problem Absolutely useless service centre with a workshop supervisor that constantly lies,1,2023-09-15
Marcus Steven Curry,Poor QC process and customer service,I purchased a 2023 Tesla Model Y in May 2023 The vehicle had so many blemishes on it at the point of delivery it seemed like it was a used vehicle I expressed my concerns to the dealership where I purchased my vehicle and they took action in addressing my concerns The problem is after Tesla had my vehicle for over a month all of my concerns were not addressed and I noticed more issues with my vehicle that the dealership assured me were rectified I also had Black Tesla badges on the frunk liftgate and my v,1,2023-09-14
Litemanning,The worst customer service I have ever,The worst customer service I have ever experienced from any retail product It is almost fraudulent how bad the customer service with Tesla is If anything goes wrong that doesn't include service Good luck trying to reach someone you are most likely on your own When you call the customer service number you wait 30 minutes minimum just to be connected to a below average customer service agent that gives you a below average experience from the start My advice is stay away,1,2023-09-13
Nelsy Leyba,Model Y,Model YI recently purchased a 2023 Tesla Model Y and my initial excitement quickly turned into disappointment After only 10 days of ownership I've noticed a significant issue with the battery not holding its charge as expected This problem has not only inconvenienced me but also raised concerns about the vehicle's reliability To address this issue I attempted to schedule an appointment with Tesla's service center Unfortunately my frustration deepened when I discovered that the earliest available appointme,1,2023-09-12
Jens Jangbäck,Tesla a company you cannot trust,Signed upp for a Grey Tesla Modely Y in June with delivery in July Aug In mid August Tesla calls and explains that the color is no longer availible I accept a change in color after a week It is now in mid july and Tesla has not even reverted with a new booking confirmation,1,2023-09-12
Tom McCoy,Endless problems with battery,Endless problems with battery really regretting buying Would get future electric vehicle from established and trustworthy manufacturer,1,2023-09-08
Messeret Tewolde,I went to trade my LR4,I went to trade my LR4 Inwas given a quote for my trade in They made me put down 250 non refundable then I found the trade in value offered for the second time to be very low I find it unfair and disheartening that Tesla requires customers to pay an upfront fee of 250 before providing them with a trade in value Furthermore the inconsistency in the initial trade in value quote which changed from 19000 to 15000 within just three weeks raises concerns about the transparency of Tesla's valuation process I kin,1,2023-09-06
Sune Boesen,Lousy service and no contact,Had my car to service as some heat problems made the car freeze dead It arrived at tesla with a towtruck I had been in contact with Tesla they had it for 1 5 weeks it took one week for Tesla to contact me about the solution which was accepted yesterday I picked it up with error on the low voltage battery and my trunk does not open anymore So basically I can once again spend hours waiting for Tesla can fix my car I can't get in touch with anyone else than their central support Get a life and let us talk di,1,2023-09-06
M WOODS,The Joys of Buying a Tesla,Would have given 0 Star rating if possible Delivery non existent Support non existent Electronic controls have a mind of their own Be careful purchasing a Tesla,1,2023-09-04
Nick Anderson,Model 3 Long Range RWD,I recently bought one of the new Model 3 Long Range RWD cars that entered the UK My previous cars were a BMW M140i and a BMW 330e Touring MSport I simply LOVE the Model 3 its wonderful in so many ways The speed comfort abd economy are brilliant I do not have a home charger so do all my charging on the public EV charging network This car handles it perfectly I get 340 miles out of a full charge 0 80 charge at a Tesla Super Charger takes only 18 minutes I am a salesman and travel all over southern England w,5,2023-09-04
HAS,The worst supply chain management of,The worst supply chain management of all car brands They don t have any idea where their cars are and have estimated delivery dates not even close to actual delivery Ordered model y in June when estimated delivery was mid July Then it was pushed to august Then beginning of september Beginning of august we decided to cancel that and order one from their stocks hoping that would come earlier estimation started with end august and now it is end september How hard could it be to handle your own stocks Final i,1,2023-09-02
Sam,Really poor service,They make it so difficult to buy a new car The website just doesn't work and is full of bugs The information is wrong and the offers are not real The after sales service is extremely poor and they just stop answering emails,1,2023-09-01
Frank P,Scheduled way in advance no part there no notification,I live an hour away from the nearest service center first problem not enough of them I had a cracked rim and scheduled the appointment 2 5 weeks in advance including detailed description of the problem model and location the part wasn't there when I arrived so had to spend 8 hours at the shop By the way I checked with them both two days before and the day before and they said the part would arrive the day of my service,1,2023-09-01
Robert Yanal,This problem was fixed six times,This problem was fixed six times Tesla never acknowledges it is an on going issue Never had such bad service on a new car When driving the screen displays only a static Tesla No cars around me are pictured I have no screen information about my blind spot Cruise control and Auto Pilot are disabled Lane wandering warnings are disabled Turn signal when changing lanes will not turn off automatically The speed limit is not displayed The ding which sounds when the traffic light changes to green is disabled Wors,1,2023-08-31
Stephen Hooker,Tesla brand in decline,Tesla brand in decline The quality of build of the cars is poor at best Mine has had 15 issues in three years Finding available super charger points now is a challenge Shame really but tesla have taken their eye of the ball,1,2023-08-31
Hillary Lieb,Poor Tesla service,A technician came to my house to fix my windshield wiper fluid that won t come out He claimed that he wasn t there to technically fix it he was there to assess the problem Ok great so I made a second appointment for another technician to come to my house and that technician said I had to actually bring the car to Tesla because he couldn t figure it out So attempt 3 failed because they still couldn t figure it out so I had to leave my car another day with them I made this appointment 2 months ago and I dro,1,2023-08-31
Shannon Seaton,Stay away from the insurance,Stay away from the insurance Purchased a new non tesla car and the won't insure it no grace period till I can get new coverage 15 30 day underwriting period in CA waiting to see if they refund me the balance of my policy or if I need to wait 2 hours to talk to someone to pursue So now I drive a rental car with added insurance while my new car sits in my garage,1,2023-08-30
Hector Marrero,Horrible Customer Services and Warranty,I purchased a Tesla Model 3 Performance 2022 for 70 000 after taxes in June 2022 Unfortunately Tesla recently reduced the price by approximately 15 7 causing my purchase to result in a loss as my car is now worth less than the new price When I attempted to sell the vehicle I received incredibly low offers ranging from 29 000 to 36 000 resulting in a loss of around 50 in just one year This indicates that the car's value will be exceedingly low in the market in the coming years Furthermore the warranty serv,1,2023-08-29
Tajammal,Extremely poor technical support,MY Tesla car is only 5 months old and under warranty For the last 3 4 months I am having issues with its charging and the maps I must have reported these issues about a dozen times and once or twice a week I get answer by virtual assistant that the problem is being investigated or I am asked to give more and more information Why can't they ask me to leave the car at their local service station and check it out There is no one to talk to or arrange a call back from local service department despite my reque,1,2023-08-29
Andriy Yaremiy,The best roadside service on a planet Elon Musk Style,I can not wait to sell my Model X and all due to their customer service I have absolutely loved everything there was about my car However their service is such trash garbage at this point I am leaving I have been patient for 8 years No time to waste anymore no more words to say Tesla you are beyond the worst human being alive You are a disgrace Shame on you I was stuck an hour away from home with my wife and 3 children asking for help because I had a flat tire It s 11 o clock at night dark cold in the mid,1,2023-08-24
Hao Wei Chan,Trashy after sales services and follow up,Trashy after sales services and follow up It is as if after they get their commission they can t be bothered with you Also their quotations are ridiculous and unreasonable For the same repair that i requested for Tesla quoted me 650 but another supplier quoted me 150 They literally marked up 400 just to widen their profit margin I like the car a lot but their service and repair team are a joke Labeling them horrible is an understatement,1,2023-08-24
geoff reber,Abysmal service,Abysmal service Car planned in for upgrades and new low voltage battery originally 1 day 2 days later still no car Tesla update the App when they can be bothered Estimated completion date is 15 00 yesterday Talk to advisors who don't give a s t Never buy a Tesla poorest service delivered ever They want to update on a messaging service but they can't keep it updated themselves Only answer I receive is 'you can keep the loaner car until complete' I paid for the courtesy car NEVER BUY TESLA,1,2023-08-23
IRRelevant,ZERO stars would be more accurate,Tesla and FSD unsafe at any speed,1,2023-08-20
Joey Ernst,Tesla solar is a scam,Tesla solar is a scam Stay far away from anything Tesla,1,2023-08-20
Loring Baker,I was excited about getting a Tesla,I was excited about getting a Tesla I asked for a return call which came quickly I paid my 250 fee opportunity to buy the car I was directed to the app and told it would be a breeze to fill out and I could get my car in a couple of days as it was in inventory and I was paying cash I was told I could call back if there were any issues The app rejected the correct insurance company code it asked for I called back innocently thinking someone would help me Nothing Five days of nothing I started a new order So,1,2023-08-18
Steve Boyd,Poor mechanical engineering and highway robbery service costs,Poor mechanical engineering After 110 000 km about 69k miles I have already had to replace a wheel bearing trunk mechanism wheel brake rotor pads and now a steering rack on my Model S In all cases the costs were outrageous more than 3 times what they would cost on other vehicles 6200 for a steering rack after 69k miles Service CANNOT be reached on the phone and roadside assistance is useless I am recommending that my friends not buy Teslas,1,2023-08-16
Mike Lue,Best electric car manufacturer period,Tesla model 3 is the best option for those looking for an affordable electric car And I am also looking forward to the FSD update to see what the Tesla team can do The news that I get from Twitter is quite impressive and inspiring,5,2023-08-14
newteslaproblems,Bought a new Tesla with significant issues Tesla doesn't care,I purchased a new Tesla Model 3 in July 2023 and quickly learned that Tesla has some of the worst customer service I have ever experienced First Tesla doesn't let you test drive your car before accepting delivery so you just have to hope the car you're purchasing from them doesn't have any significant issues I drove 3 hours away to accept delivery of my Model 3 and on the way home I noticed that the cameras would crash at times disengaging Autopilot and the GPS would freeze while this was happening as wel,1,2023-08-11
Moon Khan,This website is not good they are scam,This website is not good they are scam website,1,2023-08-10
Ian Shere,If you're thinking of installing solar DON'T USE TESLA,If you're thinking of installing solar and in the same thought the word Tesla pops up you are making a HUGE mistake We made the mistake of leasing some years ago before financiers were financing purchases with Solar City They were a bad enough company but when Tesla bailed them out it went from bad to abysmal We had an inverter go out for over 2 months so we lost a bunch of generating revenue Would Tesla even acknowledge this let alone give us a rebate on the monthly lease we were paying them LOL you jest,1,2023-08-10
Samuel Jew,The upshot,The upshotI recently left a one star review on the Model 3 based on my experience as a drunk passenger in a rental under the worst possible set of circumstances so I feel I would be remiss if I did not tell the other side of the story If you're the one driving it's brilliant It's powerful and has excellent range and efficiency on the highway vs the Bolt that's our daily driver It's also great for the supercharging system that makes Tesla really the only game in town as far as road trips with EVs go which ,5,2023-08-10
Jazyjaz XOXO,1 on WORSE CUSTOMER SERVICE,They have the worse customer service I had ever seen they make you think you're dum and on the service department they play stupid like they don't see or hear the problem and make you think the car comes with that noise and is normal thats the way the car was built OMG I regret not waiting for my Fisker Please if you don't like to talk on the phone with robot don't buy this brand You can't never get someone on the phone everything is by email and text Worse customer service ever I have 3 week with my Tesl,1,2023-08-10
