Username,Title,Content,Rating,Date
Amy Norton Mendez,Worst customer service,Worst customer service Can never reach a person phones are always busy and once you get through they hang up Been working claims for 20 years and this is the worst experience I've encountered,1,2022-09-28
jack,The worst service for a car company,The worst service for a car company that makes good cars 1 No one to talk to and I mean no one 2 Impossible to find service appointment bottom when to log in on a desk top 3 They definitely do not listen to any conversation otherwise they would know how rude and unhelpful their associates are specifically Daylen at the Santa Monica center 4 Don't bother leaving them your name and phone to call they will NEVER call you Thank God for other manufacturers entering the electric vehicle market,1,2022-09-27
Craig Slimmon,Tesla Lies,Tesla vehicles are just poor quality nothing works and the who sustainable thing is complete rubbish I have a small crack in the speaker cover on the drivers door 30 piece of plastic tops No not Tesla that want to replace the whole interior door panel for 500 money aside they want to replace a plastic door that has nothing wrong with it the cover clips out by the way So much for sustaining the planet Utter cr p both the car and the mission statement,1,2022-09-25
Andres Gelrud,My front passenger wheel deflated,My front passenger wheel deflated again It was changed for a new one in April 27 2021 by the Tesla rode side assistant they come to your home South Miami FL Today they came back again and replaced with a new tire To our surprise the tire that was placed last year had a major patch it was not new as I was charged I have photos to show It is a good idea to track back all the work done by the technician and see if other customers have had the same problem It is impossible to contact Tesla Great cars but impo,4,2022-09-25
zohreh ece,Very bad service,Very bad service I took my car to fix a noise coming from the front wheels after a few days the same problem They offered me Uber vouchers which was very much not working for me as I have little kids and little kids are not allowed in uber So I ended up paying for taxi myself They didn t even offer to pay the amount I paid for taxi,1,2022-09-24
Monica,Ordering a used car noghtmarey,I am in the process of getting my commitment from my lender and have been communicative and transparent about it with the used car team They are threatening to put the car back in stock and me lose my 500 00 deposit because it is taking longer than the 2 day period they are stating is protocol That is not after their rate came iin 5 97 and and my bank quoted me 2 95 There is t anyone to speak to higher than someone in used car leadership the person who is texting me states Seems so inefficient for the com,1,2022-09-23
PRAVEEN REDDY,Had a model x for three years,Had a model x for three years No trouble for 3 years No we have trouble regularly They have no idea of what customer service means The lady in service department in north Houston is plain rude I don t understand why she does not understand customer service I am trying to get end of lease inspection it is almost like a act of congress They are so disorganized I will never buy a Tesla again I guess Elon Musk knows how to do translational research but making good cars is one part of it but customer service i,1,2022-09-23
Mannu Mannu Sahni Sahni,Ordered car won't change date,Ordered model 3 said I can pick it up Mon Wed told them I am working can I arrange for an alternate date they said no you should take a day off IM NOT TAKING A DAY OFF TO PICK UP A CAR they said pick it up or we'll cancel the deal f u you Tesla That's what you call customer service,1,2022-09-23
Jason Connolly,Awful customer service experience,Awful customer service experience no one to speak to once the car is ordered from start to collection Even when you collect the vehicle the representatives are just there to hand you the keys God forbid you actually have a question about how to use the car Also after sales support what after sales support Impossible to get through on the telephone generic replies by robots to emails The car is good but i would avoid placing orders as if there is a problem there is no one to help you Really expected much b,1,2022-09-22
hamid rows,tesla and expenses to repair,i used to love tesla very much i told many people how great is this car model 3 tesla i have 129000 miles on it and i will list what expenses i have had to repair this car 1 front wheel was making bad noise and i had to replace around 180 dollars2 the ac broken and i had to replace and they told me is wear and tear and i used tha AC too much 4000 dollars 3 the battery shows that the range has been decreased and i am afraid to go and check how much is that to repair usury will cost 18000 to 20000 4 front h,1,2022-10-05
Richard Burdon,Diabolical support,On site rangers are great but back office email and phone support is diabolical There are multiple safety and security issues with their vehicles that are not acknowledged whatsoever once they are informed The cars are great until you need support,2,2022-09-20
Consumer in Blue Bell PA,Bad Build Sloppy Delivery Dealer Did not Check Car,Very poor delivery experience Car was scratched Door did not close properly Did not tell us that we needed to do a safety inspection within 90 days The real clincher was that we came home opened the front hood and it will not close So now we may not be able to drive it to get it fixed and may need to have it towed How difficult would it be for them to make sure that doors and hoods are opening and closing I now wonder what else is not working What a way to start an ownership experience,1,2022-09-20
Gearoid,Dreadfully poor pre sales experience,Dreadfully poor pre sales experience They ignored at least half the text messages I sent them asking questions and never sent me the vehicle licence plate number despite me repeatedly asking for it result being I could't sort out insurance for the car or pay motor tax had to chase them every few days for around a month,1,2022-09-19
Paul Timmerman,As an MD of a technology company and an,As an MD of a technology company and an owner of 4 Tesla's I think this will be last Tesla I ever take delivery off You're turning into a rude and arrogant company hard to contact poor web sites too expensive on initial purchase and service repairs I have a 2015 Model S from new and your refusal to supply me with a 1500 MRI Software upgrade blaming a shortage of Microchips is contempt and on purpose You supply thousands of new cars a day and this shortage is due to policy not to global problem cut the cra,1,2022-09-18
jen anderson,We ve owned four teslas for over 11,We ve owned four teslas for over 11 years 2 roadsters an S and an X what used to be the best customer service ever has turned into the worst customer service ever Over the past yearSuper disappointed and considering selling amd going with Rivian at this pointGreat cars but mine has been broken since February and they don t care and it s now a hazard for me to drive it We have to take it super far to get repaired and once I get it back it s still ot fixed and every time they charge us twice on Amex and my ,1,2022-09-18
Perry Friedman,Love the dive Poor quality,Love the drive Love the technology However cars are built like a bad 6th grade project Cheap material and finishes Door lines are off rubber seals fall off every season and leather seat covers are worst in industry always falling off The biggest complaint I have is customer service After spending 100k on a car the inability to speak with a person to get a simple answer is frustrating Everything needs to be communicated through the app which isn t as instantaneous and when you want an answer to something h,2,2022-09-16
Jason Brock,Mentally exhausting,I've owned my Model 3 Long Range since Christmas 2021 when I first got my car great was very happy Then when things started to go wrong hell Their customer service is unbelievably agonising I just don't understand their way of doing business and communicating It's like they are making things complicated on purpose There is never anyone to get things fixed I was waiting for months to get parts fixed Everything is done by text through the app or email that either never comes or takes days weeks to turn up W,1,2022-09-16
ANNIE CUENCA,Basically electric JUNK,Tesla basically is the car with the best performancebut with the WORST WOOOOORST customer service ever I bought a Model S for 120 000 Yes for that price you expect at least a little respect from such a high tech company I has not been even a year and yhe yoke steering wheel is peeling off plastic from trunk broke door handles got jammed and I can keep going I have been trying to get my car in service for 3 MONTHS and they keep rescheduling my appointment because they do not have the super cheap parts that,1,2022-09-16
Matthew Johnson,Do not trust your delivery date,I had a delivery date scheduled to collect my MYLR on 14 09 2022 with my full VIN number Unfortunately I received a phone call the day before saying my car had been delivered with damage and I cannot collect They are looking to fix this with approximately within a few weeks however I have not been given any support No hire car or compensation for travel expenses in the interim Communication lacking too,1,2022-09-15
ali shirazi,Almost nothing do,,1,2022-09-15
ZF,The worst customer service ever,The worst customer service ever No replies to emails No human to speak to No showrooms When you get through to a human unless you are looking to buy a Tesla you've got no hope of solving problem Don't believe the hype You can't actually believe how bad it is until you have to deal with them,1,2022-09-15
Ajith kcn,Horrible customer service,Horrible customer service No more face to face with any service advisors and none of the issues get fixed and you keep going back My car has been with Tesla for more than 2 months in the last 2 years StillIssues not fixed and horrible customer service,1,2022-09-14
Paul Alexander,They are without doubt the worst,They are without doubt the worst Company in support of their product We run a fleet of 14 cars and are constantly battling against poorly built cars a utter contempt for their customers and a don t care attitude They even openly tell their customers Wake up Tesla the competitors already build a better car and the chargers are coming,1,2022-09-14
SK,Great Car Awful Customer Service,Although I love my new car and actually had a very good experience with the repair service to take care of a couple of minor problems the customer service in general has been atrocious I actually had one woman tell me when I complained the they pushed my delivery date out by a month and a half for the 3rd time that if I had ordered the more expensive package I would have gotten it sooner I finally received my car with temporary plates These are good for 21 days 2 days before they were due to expire they r,2,2022-09-12
Gunnar Gíslason,Good,Good but there are far better options,3,2022-09-11
T Holmes,Online order discrepancy Customer service will not answer emails,I've ordered a Model S online here in Germany The web page informs me I can lease it at 1200 per month for 48 months Yet when they send me to the leasing page it states 1800 a month for 48 months I've emailed support twice asking why the discrepancy but still no answer I've also given them my info on the car I want to trade in and it has been a week and no info on the trade in available I will be cancelling and losing my 250 deposit,1,2022-09-09
dan demeson,Not taking responsibility for their screw ups,My main problem is with the Austin service center they do not take responsibility for their screw ups they fix one thing and break another and they won t repair it the past three times I ve been in the screwed something up I had the headliner replaced and now the roof rack won t fit on and they won t fix it I did not tell them to replace the roof I told them to replace the headliner I had a new door panel put on it s the wrong color and they won t put the right one on and charged me for it I filed a compl,1,2022-09-08
Alan Spittle,Great car terrible service,To say Tesla is bad at customer service is an understatement if I could have given them 0 stars I would Most of the models in their range are considered by most to be prestige cars or at least this is reflected in the price tag I bought a Model S about three and a half years ago for nearly 95k which compares to previous cars I ve bought from Mercedes and Audi Since then I have been impressed by the capabilities and technology of the car whilst at the same time irritated by the build quality and customer s,1,2022-09-08
NIGEL,Do not deal with Tesla,Do not deal with Tesla without doubt the worst company I have had the misfortune to deal with I have been misled by staff at their Norwich branch and their customer service STINKS I have just cancelled my order for 2 model ys,1,2022-09-08
Ben Fischer,Tesla Plaid failure,Tesla Plaid less than 1 year old has drive failure and car shutdown in middle of the road with kids in the car Takes over an hour to reach Tesla roadside service and hours before Tesla tows it 2 hours away no communication now They promised to provide a loaner or rent a car during the repair now they won t honor their commitment Tesla has major quality and service issues so they just make false promises and then disappear Unlike the 5 star service of 4 years ago this is behavior of a shady group My 3rd an,1,2022-09-08
Thao NG,Terrible customer service,Terrible customer service Tesla gives me a car with a tiny hole in the rim causing leakage of air after 1 day of delivery Tesla technician could not find the league issue which was found by a small tire store And that was funny with a big company Tesla controls the parts and replacement and tesla employee thinks they have the right to let customers wait to charge the money even the issue from Tesla The car is very good but the part and customer service are terrible order number r RN116913393 Disappointmen,1,2022-09-07
SK,Tesla has the worst customer service,Tesla has the worst customer service and also service centers Tesla is delivering their vehicles with defects and service team is not fixing it in one shot we have to go twice or thrice Looks like Tesla is delivering their cars with minimum pass and fixing it in service center after delivery,1,2022-09-07
JHS,Telsa Service Centers absolute worst,Telsa Service Centers are the absolute worst in the automotive industry You can't talk to a live person Even for repairs that leave you car disabled you are weeks out Everyone that works in the service center is upset Tampa Florida Customers are all visibly upset Recalls for safety issues are months if not years out I am at 3 weeks with my car in for simple air conditioner repair 1 200 diagnosis fee and they won't order the parts until I approve the diagnosis fee 3 weeks They left me in the waiting room f,1,2022-09-20
Margo O' Mahony,Non existent support in Ireland or Spain,I could never have imagined it would be as bad as it is Calling their customer service centers in Spain or in Ireland neither care to help Long wait times followed by dismissive answers My car has not connected to the internet since May its Sept and I'm still trying to get this resolved My car started squeaking I eventually had to take to youtube to understand why I recommend taking this into consideration to anyone thinking of buying a Tesla,1,2022-09-06
dhaines,tesla fails miserably at customer service,Tesla's website is not user friendly It constantly directs the user to their tutorials which are useless once you have taken the steps in the tutorial and the problem persists the real issue is the constant changing of the service maintenance dates without notice and the failure of service personnel to show up to resolve the problem i have been without the use of my solar panels since february 2022 my electric bills have doubled and i have been unable to get a maintenance person to show up to resolve the ,1,2022-09-06
Anna,Worst Customer Service Never Buy Again,Customer service and service centers have been awful since day one It s so bad that I would never buy another one Paid over 120k for my model X and they can t even treat you with basic customer service skills let along show appreciation for you as a customer When I picked up my car for the first time four years ago they towed away my trade in without letting me clean out my stuff They couldn t locate it until the next day and by then thousands of dollars worth of designer sunglasses jackets car seats and ,1,2022-09-05
Dane Olsen,Tesla service in Tampa Florida is,Tesla service in Tampa Florida is terrible I've had my 2015 model s there 3 times now Service is slow Usually have to leave car overnight for something simple Never get a complimentary car Spending lots of time and money on rental cars and driving 40 miles to location Thinking about selling it soon Not what I expected,1,2022-09-05
erika de la torre,Ridiculous estimated delivery dates,Ridiculous estimated delivery dates Do not believe what dates it says when ordering My order keeps getting delayed Says we are waiting on a vin number but has been delayed over a month now I ve had to reapply for my loan twice and have been out of a car since the beginning of aug because my delivery date said aug 15 It s now pushed back to sept 13 to oct 11 When I contact the rep that messaged me asking if I was ready to proceed with my delivery all she reply s with is waiting on VIN,1,2022-09-03
R M Motors Ltd Mackereth,Tesla Leeds hold your heads in shame,Tesla Leeds hold your heads in shame Your customer service front of house skills are non existent Right hand doesn't know what the left one is doing,1,2022-09-01
NDA,22 000 miles so far and I'm perfectly,22 000 miles so far and I'm perfectly happy with my Model 3LR On the three occasions I have had to go to the service centre in Winchester they have been super efficient and fixed the problems 1st was a misaligned door 2nd some paint correction and finally a chipped and replaced windscreen I am only writing this review as there have been so many negative ones,5,2022-08-31
TIEDEMANN,Great service Remains to be seen,Heard a lot of great things about tesla service remains to be seen I ve experienced lockout two times within 4 days The mechanic was able to start the car but couldn t transport the car to the local tesla service center Instead i did that and upon arrivel i was told that they had no loaning car and they didn t even mention a rental car I was told that both loaning car and the complementary 80 of taxi drive only one trip depended on whether the problem was teslas or not they needed a diagnosis So far its b,1,2022-08-31
Maged Samaan,So nasty staff and soooo bad customer,So nasty staff and soooo bad customer service I ever I see in my entire life,1,2022-08-30
Scott Mcbride,Picked up a brand new Model Y,Picked up a brand new Model Y I'm a huge Tesla fan and was so excited to get my car after a 5 month waiting period The front door will not even close without slamming it so hard you think you will break it The quality of the service I received when I picked it up was so disappointing I cant believe this left the factory like this and the dealer inspected it and didnt call to reschedule the delivery Ive asked to have a manager call me multiple times but good luck talking to a person You think you are getti,1,2022-08-29
diane devlin,The worst customer response by the,The worst customer response by the adjuster if you get a Tesla dont have an accident It will take forever to get you vehicle repaired or even looked at It is now going to take 2 months just to get the vehicle into a repair shop that is tesla certified,1,2022-08-29
Jason Moisey,Not a clue,Following a test drive and having got a little too over excited it is a brilliant car at the Birmingham branch I placed a business lease order for a Model Y with the sales man What a nightmare No one can confirm what where or why my or car is in the process Tesla constantly blame and refer to ALD their chosen finance company ALD constantly blame and refer to Tesla No party has a clue what the other party should be doing A month on and I have nothing to confirm against so have told them to forget whatever ,1,2022-08-25
dave g,Model S is a poor quality low grade car,Model S is a poor quality low grade car that is so overrated it s untrue Customer service is as poor as the car itself I have had so many problems over the four years of ownership that it s not worth listing then here Just avoid,1,2022-08-24
D R,Really great service from Tesla in,Really great service from Tesla in Heathrow Picked up the case at very short notice due to the incident at Park Royal Quickly located the source of a rattle and fixed it Polite efficient and kept me informed throughout,5,2022-08-24
David Deitch,Been on hold waiting to ask a simple,Been on hold waiting to ask a simple question about my Tesla Y Been on hold now for 40 minutes Hung up in frustration Tesla must do better,1,2022-08-22
Rob H,Tesla after sales is worse than appalling,I have a 2019 tesla X 100D purchase price c 117000 00I don't usually revert to complaining like this but anybody reading please be aware The Tesla after sales is worse than appalling and I can't begin to express my frustration enoughI have been lucky enough to have owned some amazing high end vehicles including Aston Martin DB9 Maserati Gran Cabriolet Ferrari 575M Marinello Still got it and Audi RS6Im not bragging as I know how lucky I have been to experience some awesome cars and have had dealings with a,1,2022-10-06
jjh4yb,Customers are not kept informed of progress,Car in to have some suspension parts replaced Booked in for a 10 12 appointment i e a 2hr slot Just before 11am I received a message on their app saying there was a delay caused by no ramps being available I responded asking for an estimate as to when car would be ready No response was received The app advises you to monitor it for car progress and estimated completion times All it says is car in for repair and no completion times I resorted to calling the support line and was told they would contact the ,1,2022-08-18
MIKE,Wheels ordered on the website,Wheels ordered on the website Charged from credit card the day after Nobody knew where my wheels were After months of daily calls and emails to Tesla and Tesla service centers i could pick them up 175 km away from home When I picked them up the rims were all scratched dented and som of them must have rubbed against some steel as there were rust in the scratches on the rims Very bad customer service with very rude employees,1,2022-08-18
Mark Jenkins,Terrible customer service,Terrible customer service Placed an order for model Y high performance with autopilot 74k car to purchase by my business A glitch in their online ordering system meant the order didn't process correctly but they still took the deposit payment even though no car was ordered and nothing showed on my tesla login I called their helpline as their livechat is rarely on the staff who man the phones don't appear to be trained or understand their systems Emails are a waste of time and take days for a undetailed re,1,2022-08-18
kevin otten,Just had some work done at the chester,Just had some work done at the chester service centre staff all happy to help and work carried out professionally Tesla have been a breath of fresh air never again will I buy a internal combustion vehicle our Tesla model3 has been amazing,5,2022-08-18
Nekfod,Super service,,5,2022-08-18
Rodney Niya,Having employees that love their job shows,Excellent greeting communication through the process and took multiple steps to make sure I was happy with the result A,5,2022-08-18
Bruce Wyborn,I had a noise coming from the front,I had a noise coming from the front right wheel I lodged a service call Tesla Mobile came to my house and promptly fixed the issue Fast courteous service Very happy with Tesla Service,5,2022-08-18
Eric Nary,I have a 2020 Model Y Performance,I have a 2020 Model Y Performance Service is almost never needed and when I have used service it has been outstanding The car is so quiet it is amazing and the performance is out of this world I have never been in a nicer car Just shocking,5,2022-08-18
Al Fatt,Best car,Best car I've ever had No issues in over two years,5,2022-08-17
Steve F,Tesla Service Experience,This review covers my experience with Tesla service I owned a Model 3 for two years and currently own a Model Y which I've had for a little over two years During the past four years covering both cars I've needed to take the Model 3 in to a service center once and that was to get it's FSD computer upgraded That appointment went without incident Also over the past 4 years I've used Tesla mobile service 4 times to perform tire rotations replace cabin air filters and twice to sanitize the AC condenser coils ,5,2022-08-17
Kenny P,So happy with my Model 3,So happy with my 2019 Model 3 that I replaced my second car with a model Y,5,2022-08-17
Andrew Miller,First ever Tesla Service Center visit,First ever Tesla Service Center visit Scheduling through the app worked great Rolled in and was greeted by the service advisor straight away Out in 3 minutes Vehicle was ready at end of day as promised No pressuring or hard sell to get additional work done hello BMW dealership,5,2022-08-17
Robert,The car itself is good the service isn't,The car itself a model 3 long range is decent No denying that The service side is probably the worst I've ever experienced For a 60k car you'd expect decent service The departments are shoddy rude and vilify their customers I wouldn't buy another tesla when I finish with my current one due to the awful experience I've had,1,2022-08-17
