Username,Title,Content,Rating,Date
Michelle Crowther,Customer Service Manchester,Having taken delivery of our Y model recently I felt the need to acknowledge the great service we received The salesperson dealing with us went out of his way to resolve the ongoing technical issues we were experiencing when trying to purchase the car through the Tesla app However having not been able to resolve this in the end we had to complete all the relevant forms the old fashioned way via email Rueben discovered the issues were not with the Tesla but with the finance company's system Rueben Callau spent time trying his best to help resolve these issues Without his help we would have simply given up on the purchase Thanks for going over and above Reuben,5,2024-08-21
Volkan engüller,After I ordered my new car,After I ordered my new car the referral campaign started I wanted to participate without taking delivery of my car A Tesla official called and offered to give it to me as Tesla credit without participating in the campaign I accepted this offer but they have now refused to deposit the money My advice Don't rely on verbal conversations with Tesla Ask for written confirmation,2,2024-09-23
Hannah Catley,How do they get away with stealing from people,They took 2 months to organise financing on a used car when I came to my senses and cancelled my order they immediately ghosted me not a single person has been in contact with me to confirm the cancellation or the refund of my 5000 It s been 2 months and still no contact their customer service is non existent How does such a big and well known company get away with stealing from people,1,2024-10-09
Anony Mouse,Bought a used Model X and love it,Bought a used Model X and love it Minimal unexpected maintenance costs Regular updates on the app App contact informative helpful and timely Service appointments in Scotland are not as great as the Exceptional Milton Keynes Branch I wish there was a Service Centre in Inverness And if they put one there to make it as good as the Milton Keynes Branch Arnold Clark s Arnold Shark as its lovingly described in Inverness market share would go down the toilet An Inverness Tesla Service Centre would save me having to drive to Milton Keynes to get my car serviced which admittedly is not very often The only niggle I wish there were more multiple Tesla charge points in Scotland Fraserburgh Elgin Golspie Wick and Ullapool They would be the locations which would destroy the awful CPS Swarco offering in one swoop Love you Tesla Please please please lobby the Government to get rid of Swarco and get the funding you need to create or add to your Awesome charging infrastructure in Scotland,5,2024-09-14
Rhys Whalley Miller,Worst customer service Cars good,Cars good Customer service terrible Trying to get into contact impossible Was sold a 185 speaker for my car which it always has the technician was shocked I was sold it and they refused to return it,2,2024-10-08
Anne,I join the majority of reviewers in,I join the majority of reviewers in reporting on terrible Tesla service or lack thereof today I have a slow leak in a tire First the roadside service part of the app didn t work The confirm location button froze and I could never get through Second the regular service section of the app said that it would be 17 DAYS before I could get an appointment to repair or replace the tire Finally I eventually got a phone number for my local dealership s service bay to seek help with the roadside problem and never got a call back Tesla service is disastrous and this car will be gone as soon as possible Unfortunately and understandably no one is going to want it,1,2024-09-22
A Hamza,Excellent customer service,Excellent customer service in the Birmingham UK branch Made to feel very welcomed and given the opportunity to test drive even after being informed that I was using a salary sacrifice scheme Jasmine was very knowledgeable and gave us the respect time and space required to make a decision Ordered the car this week Keep up the good work Jasmine a great testament to the company Well done for hiring this one Tesla Keep it up,5,2024-06-23
SuperiorLux Property,Not worth the overall cost,The repair costs are not worth the purchase If at any point you need to deal with Tesla Service IN CT at least you will severely and thoroughly regret ever buying a Tesla The car itself is great but when it breaks it costs more than an entire used car Literally and anyone that disagrees I have the receipts to prove it The cars may be sexy fast efficient but overall all said and done pound for pound adding up all of the time you spend charging and repair costs my final answer is no not worth it I basically spent over 100 000 on what is essentially equivalent to a 20 000 value I do not recommend I would not recommend and I will NOT be purchasing another Tesla in the future I was under the impression that the longer a vehicle is in production the cheaper the parts would get I am wrong They go up,1,2024-10-14
WinDor,AVOID Shocking Tesla Service,Tesla Service Experience Frustration with Sheffield CentreI loved driving my 2021 Tesla M3P with 25k miles and an aftermarket aero kit until I needed service at the Sheffield Centre 1st visit early July No work done but both front wings were scratched 2nd visit July Held my car for four weeks failed to secure panels didn t fix their scratches as promised and broke my front splitter which I was going to remove but tesla advised against it apologised and promised to 'put it right' then they refused to cover repair costs on the quote they requested 3rd visit Sep They removed and discarded my custom T badge without approval saying replacements were cheap no apology given My splitter repair is still in dispute with no response It's a shame as I really enjoy driving the car Note to Tesla time for you to recognise the existence of your customers Sorry I can't rate you less,1,2024-10-02
Cavan Hadley,I have a 2019 Tesla model three with,I have a 2019 Tesla model three with 65 000 miles and it won t even get 150 miles on 100 charge This thing is a lemon,1,2024-11-16
Consumer,Appalling customer service,I have leased a Tesla 3 and decided to hand it back a year early due to my circumstances changing I contacted Tesla finance by email and eventually following several emails later they replied and said I needed to pay a certain amount to be able to hand it back This I have done and sent several emails to confirm this has been done and also left a number of voicemails as you can t actually speak to anyone about it I am still waiting to receive instructions about how to hand it in Disgusting customer service I will not be recommending anyone leasing a Tesla and certainly won t be purchasing another one,1,2024-09-03
Martin Noon,Worst service,Worst service No way to actually communicate with the service centre correctly Messages either delayed ignored or answered incorrectly Kept my car for 4 days Then messaged 4 days later saying come and collect We did not fit the part because it's scratched please book another appointment App is very buggy for service items,1,2024-07-21
Muhammad Ismail Greg Robinson,After reading Tesla thank for for destroying our planet,After reading Tesla thank for destroying our planet and Elon denial about the fact he can t dispose of the batteries and if using he s been talking rubbish it takes certain types of foam to put them burning,1,2024-10-26
Margaret,tesla is not living up to their promise have requested the promised refund on,I have requested the promised refund on the cybertruck reservation deposit twice and haven't received even an acknowledgement How do I get my promised 100 back,1,2024-10-31
BODY SHOP,A Body shop repair bad Experience with tesla,We are an auto Body shop repair business and we work with different insurance companies I wanted to make this review because we have had to deal with Tesla dealer and insurance services and according to the experience we have had it is the worst insurance company we have been able to work with when it comes to handling a vehicle claims damage and you want to get in contact with someone big surprise is that no one answers their phones no one returns calls or emails vehicle can be seating at the shop for months waiting on approvals for repair and no one answer or email back it is very stressful and frustrating So if you haven't experienced this problem yet you probably will For those of you who are thinking about getting this insurance or a tesla at all please do your research because you are in for a big surprise if you dont,1,2024-10-04
David Thompson,Absolutely awful customer service,Absolutely awful customer service takes around 2 weeks to reply to an email absolutely impossible to get hold of a human on the phone I will never buy a Tesla again,1,2024-10-04
Cary,Abhorrent Customer Service,Tesla has morphed into this app oriented company that is oblivious to honest and good customer service I had a 2021 MY lease I was sent a text message through their app that if I returned my car early I would receive incentives waive 2 months of lease payments and a 750 credit toward Teslas products The fine print that wasn't disclosed was that I had to do that within one week I started the process texted them back with an acceptance text DAYS later I receive a text that had a date scheduled for me to drop off the car Coincidentally I purchased a new 2024 MY which I was hoping to pick up at the same time Unbeknownst to me picking up my new MY was in a different city 200 km away from the Tesla dealership where I dropped off my lease In the meantime trying to schedule my drop off and pickup was a nightmare Tesla has no phone numbers where one can talk to a human to sort this out As it Turned out the scheduling did not happen within the week They did not honor their incentives because I was late beyond the one week in completing the deal Can you believe it They choke all their communication so customers have limited if any ability to communicate with a human to sort out these situations And when this extends the deals beyond their arbitrary deadlines they renege on their incentives They are the WORST Even though I now drive a Tesla I am recommending that people that want to drive an EV go elsewhere Save yourself the aggravation of dealing with these thieves,1,2024-10-25
Leo James,Brought my model x to tesla for a tire,Brought my model x to tesla for a tire rotation and tesla never informed me that the although the tires were 6 32nds in the rear there were massive shoulder damage on the inner portion of the tire yet they still performed a rotation They easily dismissed my concern and will not address the concern which may be an alignment at the time of rotation,1,2024-09-26
Consumer,Dreadful Customer Service,Dreadful Customer Service It took and incompetent uncaring team 3 weeks to fix my motor with only 21000 miles done The Sales staff were rude obnoxious to boot Don t by a Tesla They can t or can t be bothered with repairs Buy BYD instead I don t think they can be worse US is dead too,1,2024-09-27
Mette Olesen,Tesla has terrible customer service,I have had Teslas since they first came out I love the car BUT the business model has evolved over time into a very poor experience as a customer One month after I bought my last car they dropped the price twenty percent They also charged for the power cord and started charging for the use of super chargers The standard rims for the Model3 are terrible But worst of all they do not have customer service beyond an app interface If you value good customer service do not buy a TESLA,2,2024-07-01
Alessandro Pontes,It s been frustrating,I purchased a used certified pre owned vehicle from Tesla expecting a high standard of quality given the description that the car had undergone a thorough inspection Unfortunately the reality has been quite the opposite From the moment I took ownership I found myself performing the inspections identifying issues that should have been addressed beforehand Despite multiple attempts to resolve these problems with my local Tesla service center I am now scheduling my third visit in just three months On top of this the battery range has been another significant disappointment Tesla s commercial team presented me with a range far above what the vehicle actually delivers which is now showing only 75 of the promised total This has been a frustrating experience far from the quality and reliability Tesla claims to provide with their certified vehicles,1,2024-10-24
Qwerty,Tesla rubbish,If there was 0 star that would be appropriate Most overrated car ever thanks to free media publicity Tesla gets not sure to help boost their share price Yet reality is Tesla is nothing but rubbish in my honest opinion Thank God Chinese BYD and others have delivered some great electric cars I wouldn't be surprised if Tesla goes bankrupt in the next few years Do your research even the so called Cyber truck is the same I heard Door happens come off if you shut the door with force,1,2024-08-08
guardsman,Feel bitterly disappointed,Feel bitterly disappointed by the level of service from tesla I was emailed a delivery date for my new car After taking time off to recieve the delivery and waiting sometime I emailed the advisor to be told my car was reallocated and that car would not be delivered After I wrote to them again three times before even getting a reply This has ruined my thoughts on this car and I am extremely worried about the level of service I will recieve if I ever get the car,1,2024-09-04
K Smout,Appalling customer service,All the money you pay and you get treated like a mug We were frustrated enough that we needed to make a 140 mile round trip to pick up a car for an employee we've always had company cars delivered before but we didn't buy direct from Tesla before We had to place an order thro the website which isn't great to navigate then pre agreed a delivery date to align with existing car lease ending this itself a pain because you can only agree the date a few weeks before Then at the 11th hour Tesla and ALD their finance Co fail to communicate with each other and as a result the delivery day is changed We now have to take off more time change the insurance arrangements and that's before we get there and experience the 'light touch' handover which I've not heard good things about Never again will we buy a Tesla regretting this purchase before we've even got the car We're a small business and the whole process has been inflexible and cost us time and consequently money,1,2024-09-11
ENC,Hard rattle and squeak,Tesla Y experience after one year summarised Good Supercharger network Autopilot Ability to precondition cabin Integration with Apple Music Spotify etc Bad Constant rattles and squeaks that Tesla has tried but failed to fix and undermine otherwise silent driving Ridiculously hard suspension for UK roads The ride basically feels cheap If driving long holidays supercharger network still gives Tesla the edge If not higher quality softer rides exist,3,2024-06-10
D Rup,How can Tesla stay in business,We have a Tesla solar powerwall system Installation was a nightmare as their technician miss read his tool and thought Kg were lbs Ended up costing and much aggravation they denied it for months and then finally admitted it and fired the employee Now our system has been down for 4 months and the service call was just postponed another 2 months because the lost a service team Elon laid them off,1,2024-05-20
AntR,This company is going from bad to,This company is going from bad to worse I have been informed by Tesla customer service that their policy on allocating loaner vehicles has changed Considering most customers have between a 1 and 2 hour drive to the the nearest service centre then Tesla drivers could be in for some serious waiting times at your local centre I for one won't be staying with Tesla,1,2024-07-11
customer,What a total joke of a company,What a total joke of a company We put down a deposit for our car a brand new Model X Due to a hurricane the financing was delayed The dealership told us that if we didn't pick up our vehicle we would lose our deposit AND the car would be sold to someone else All we needed was a few more days for Navy Federal to finish the application which was never in doubt Instead to avoid losing the deposit and the car we went through Tesla finance at a higher interest rate and will re finance ASAP We think it was because it was the end of the quarter on top of it right after the APR through Tesla went down Furthermore we found defects in the car including a rattle and badly applied trim The Falcon doors promptly opened into the garage door tracks and scratched the paint since their sensors don't sense properly I can't get anyone to call me back from the dealership and I can't get in touch with the company BEWARE there are no live people to talk to Everything is a pre recorded message or handled through the app Worst ownership experience I've ever had in 35 years of purchasing vehicles Tesla clearly thinks that they are in such demand that they can get away mistreating people and that someone else will be along to take their place,1,2024-10-07
Antonio,Frustrating experience dealing with Tesla product support,My Tesla wall connector has developed a fault and would not charge my Tesla car anymore I thought it would be straight forward matter as the product was still under warranty I went on to the Tesla app and followed the instruction to try to get the matter resolved It was tedious but I was OK to go along Little did I know that I was about to embark on a nightmare journey There was little support rather I was asked to provide all kind of checking results There was a lot of back and forth by emails without knowing if there was a real person at the other end They asked for all the minor details even down to the complete wiring scheme of the wall connector I am not an electrician and the connector was installed by a Tesla recommended company I suggested Tesla to send someone out to inspect the connector themselves in order to confirm that the devise was truly faulty There was no reply no response complete radio silence This matter is still unresolved and I still can't use the wall connector It is quite an eye opener about how Tesla treats its customers,1,2024-09-26
Charles R,Worst service of any car company,I have a Model 3 It is without question the best car I've ever owned But then it needed service and Tesla's service system is SO AWFUL that it truly ruins the entire experience It's not just slow it how rudely customers are treated and how they hide behind a mask of technology It is impossible to speak to a human and their text messaging system usually just involves repeated canned answers They constantly reschedule try to blame me for not responding even at one point blamed me for rescheduling when it was their system Tesla how can you treat customers like this And how can you not have a person available to resolve matters when you buggy computer system fails,1,2024-07-19
Holly,Can't get ownership transferred,Can't get ownership on my Tesla transferred going on 5 weeks Previous owners transferred ownership and removed themselves Tried the app and there's a glitch and it won't complete because it says to connect the car to the internet which it is as indicated by the green check Told to wait 5 days just for an email took over a week Uploaded the required documents and told to wait another 5 days It's now past that and still nothing,1,2024-04-28
Mark,Tesla Model 3 2021,Tesla Model 3 2021 battery failed after 17900 miles still under warranty warning alert that max charge and range maybe reduced ok to drive book service soon Booked service request told wating for parts 1 month later still waiting for parts which turns out to be a new HV battery pack Max charge dropped to 70 then 39 and refusing to charge car unusable and been unable to use for work and need a car to get to the airport in 2 weeks Trying to sort a loan car from Tesla but no one cares no service or support Given run around through endless telephone menus Shocking Given the issues we've had with the 3 Tesla's the business purchased we won't be buying new Tesla's when the lease is up in a years' time unless they do something amazing to sort out this mess Shouldn't expect this after only 17k miles but apparently reading online a widespread problem,1,2024-06-28
Anthony Kenny,Customer service is an Oxymoron,Tried to contact their customer service multiple times for a Powerwall after 2 calls of over 1 hours on hold I gave up Customer service is non existent I'm sure I'm not the only one as well with over two thousand reviews and 73 being 1 star,1,2024-08-21
Kevin Houle,Service process and reschedules are horrible,First off the quality of this vehicle is way behind the Big Three in the US Delivered with hidden issues like a loose nut that rolls from side to side and a rip in the lower part of the dash that wasn't seen until a week in Scheduling service has been miserable appointments get rescheduled every time so far now from January 4 times out to July 8th This is horrible,1,2024-05-25
Farshad Khatabi,Mr Musk asking people for money like a,Mr Musk asking people for money like a begger by investing in her Plattform After I signed up to get information for investment I found out that his concentration is on investing in Crypto coins and oil companies which all are anti environment All of what he told about green energy new environmental solar panel and etc was a big lie His social credit is minus zero to me,1,2024-05-20
Duncan,I'll never use another Tesla product,I'll never use another Tesla product again in my life I've used Tesla Solar City solar panels on my home since late 2017 In mid 2024 my roof suffered extensive damage due to high winds and hail So I had Tesla remove my solar panels prior to the roof being repaired It cost 1 640 00 to have Tesla remove my solar panels I was informed that the cost of 1 640 00 was the total cost to have the solar panels removed and replaced But after my solar panels had been removed which was unavoidable only then was I informed that it would cost me 4 160 00 out of pocket to have the solar panels reinstalled on my roof I find that to be deeply dishonest It reminds me of what scam artists do Paying customers should be informed up front as to all costs incurred in a transaction Tesla did not inform me of the total cost until after my solar panels had been removed Tesla lost a customer For life By the way since I had the solar panels installed Solar City was bought out by Tesla the customer service phone number ceased to exist and all ALL communication with Tesla had to be done via an online chat through Tesla's website That meant you had to be stuck at your desk for upwards of half an hour while the Tesla employee took minutes to respond to each inquiry I typed in Now even the website online chat is gone and a customer has to download a Tesla app onto his or her phone just to communicate with someone at the company but still only via chat People use solar panels to save money Tesla apparently doesn t agree,1,2024-10-24
Steven R Davison,Tesla is the Best Car I've Owned,I'm 72 and I bought my first Tesla 18 months ago I absolutely love my Model 3 Performance Over the years I've had several high performance cars but this one is by far my favorite It's so much fun to drive and much more practical than all the other cars I've owned Love that I can charge it in my garage while I sleep at about one third the cost of gas Love that with over the air updates the car keeps improving Love that it can drive itself Etc etc etc My wife was meh when I bought the car but now she drives it whenever I don't need it and her car remains parked Tesla's are leading the car market into the future,5,2024-07-28
Roy Foo,Non existent support extremely long wait time,Very long wait time Service and customer support will give many reasons why the vehicle is normal and do not need repair Phone agent will get you to other departments to get you off the phone The support is basically non existent It is painful to get problems resolved,1,2024-07-12
Doug B,Service a China company on Amazon would be proud of,Our car has been in the Tesla shop for over a month and counting They do not communicate they do not have consistent answers on status when you drive there to get a response This company is brutal on customer service You could not provide a more incompetent and infuriating experience if you tried If i did not know better I would think i was on candid camera Please do not buy a Tesla if Elon knows the S is going on shame on him,1,2024-07-30
Niki Knopf,I will never buy another Tesla because,I will never buy another Tesla because they have the worst customer service I ve ever experienced After my car would not start and I called their roadside assistance to get to an operator they told me they could not help me and the best I could do is call 911 Every service agent treats you like a number You can only talk to them via an app They don t care Highly recommend buying a different car,1,2024-07-01
